Sender: LSF System <lsfadmin@cpt08>
Subject: Job 971432: </data/unige/funpopgen/odelanea/SHARE/clomics/bin/clomics quantify --bed /data/unige/funpopgen/grey2/SYSCID/BLUEPRINT_DATA/CRD/THREE_CELL_TYPES/CLOMICS/EGAD00001002672_CLOMICS_v3.0/merged_residuals.bed.gz --region 18 --tree /data/unige/funpopgen/grey2/SYSCID/BLUEPRINT_DATA/CRD/THREE_CELL_TYPES/CLOMICS/EGAD00001002673_CLOMICS_v3.0/EGAD00001002673_ALL.chr18.module.txt.gz /data/unige/funpopgen/grey2/SYSCID/BLUEPRINT_DATA/CRD/THREE_CELL_TYPES/CLOMICS/EGAD00001002673_CLOMICS_v3.0/EGAD00001002673_ALL.modules.MOD1.NRE2.txt.gz --out /data/unige/funpopgen/grey2/SYSCID/BLUEPRINT_DATA/CRD/THREE_CELL_TYPES/CLOMICS/CELL_TYPE_COMPARISON_GENE_CRD_ASSOCIATIONS/quantify//72_vs_73_ALL.chr18.loom\.txt.gz --loo 0 --normal> in cluster <ug> Done

Job </data/unige/funpopgen/odelanea/SHARE/clomics/bin/clomics quantify --bed /data/unige/funpopgen/grey2/SYSCID/BLUEPRINT_DATA/CRD/THREE_CELL_TYPES/CLOMICS/EGAD00001002672_CLOMICS_v3.0/merged_residuals.bed.gz --region 18 --tree /data/unige/funpopgen/grey2/SYSCID/BLUEPRINT_DATA/CRD/THREE_CELL_TYPES/CLOMICS/EGAD00001002673_CLOMICS_v3.0/EGAD00001002673_ALL.chr18.module.txt.gz /data/unige/funpopgen/grey2/SYSCID/BLUEPRINT_DATA/CRD/THREE_CELL_TYPES/CLOMICS/EGAD00001002673_CLOMICS_v3.0/EGAD00001002673_ALL.modules.MOD1.NRE2.txt.gz --out /data/unige/funpopgen/grey2/SYSCID/BLUEPRINT_DATA/CRD/THREE_CELL_TYPES/CLOMICS/CELL_TYPE_COMPARISON_GENE_CRD_ASSOCIATIONS/quantify//72_vs_73_ALL.chr18.loom\.txt.gz --loo 0 --normal> was submitted from host <cpt01> by user <grey2> in cluster <ug>.
Job was executed on host(s) <cpt08>, in queue <normal>, as user <grey2> in cluster <ug>.
</home/grey2> was used as the home directory.
</data/unige/funpopgen/grey2/SYSCID/BLUEPRINT_DATA/CRD/THREE_CELL_TYPES/CLOMICS/CELL_TYPE_COMPARISON_GENE_CRD_ASSOCIATIONS> was used as the working directory.
Started at Fri Mar 15 13:43:18 2019
Results reported at Fri Mar 15 13:43:23 2019

Your job looked like:

------------------------------------------------------------
# LSBATCH: User input
/data/unige/funpopgen/odelanea/SHARE/clomics/bin/clomics quantify --bed /data/unige/funpopgen/grey2/SYSCID/BLUEPRINT_DATA/CRD/THREE_CELL_TYPES/CLOMICS/EGAD00001002672_CLOMICS_v3.0/merged_residuals.bed.gz --region 18 --tree /data/unige/funpopgen/grey2/SYSCID/BLUEPRINT_DATA/CRD/THREE_CELL_TYPES/CLOMICS/EGAD00001002673_CLOMICS_v3.0/EGAD00001002673_ALL.chr18.module.txt.gz /data/unige/funpopgen/grey2/SYSCID/BLUEPRINT_DATA/CRD/THREE_CELL_TYPES/CLOMICS/EGAD00001002673_CLOMICS_v3.0/EGAD00001002673_ALL.modules.MOD1.NRE2.txt.gz --out /data/unige/funpopgen/grey2/SYSCID/BLUEPRINT_DATA/CRD/THREE_CELL_TYPES/CLOMICS/CELL_TYPE_COMPARISON_GENE_CRD_ASSOCIATIONS/quantify//72_vs_73_ALL.chr18.loom\.txt.gz --loo 0 --normal

------------------------------------------------------------

Successfully completed.

Resource usage summary:

    CPU time :               1.36 sec.
    Max Memory :             3.18 MB
    Average Memory :         3.18 MB
    Total Requested Memory : 8000.00 MB
    Delta Memory :           7996.82 MB
    (Delta: the difference between total requested memory and actual max usage.)
    Max Swap :               32 MB

    Max Processes :          1
    Max Threads :            1

The output (if any) follows:


[32mclomics[0m
  * Authors : Olivier DELANEAU / Emmanouil DERMITZAKIS
  * Contact : olivier.delaneau@gmail.com
  * Webpage : XXX
  * Version : XXX
  * Date    : 15/03/2019 - 13:43:21

[32mQUANTIFY MODULES[0m

Initialize random number generator
  * Built-in seed is 15112011
  * First Integer = 30554
  * First Double = 0.0126695

Reading sample list from [/data/unige/funpopgen/grey2/SYSCID/BLUEPRINT_DATA/CRD/THREE_CELL_TYPES/CLOMICS/EGAD00001002672_CLOMICS_v3.0/merged_residuals.bed.gz]
  * #samples = 160

Merging sample sets from all input files
  * #files = 1
  * #samples in all files = 160

Scanning phenotype data in [/data/unige/funpopgen/grey2/SYSCID/BLUEPRINT_DATA/CRD/THREE_CELL_TYPES/CLOMICS/EGAD00001002672_CLOMICS_v3.0/merged_residuals.bed.gz]
  * target region [18]
  * 2935 phenotypes included

Sorting phenotype data and allocating required memory
  * #samples = 160 #phenotypes = 2935

Reading phenotype data in [/data/unige/funpopgen/grey2/SYSCID/BLUEPRINT_DATA/CRD/THREE_CELL_TYPES/CLOMICS/EGAD00001002672_CLOMICS_v3.0/merged_residuals.bed.gz]
  * target region [18]
  * 2935 phenotypes included

Reading tree in [/data/unige/funpopgen/grey2/SYSCID/BLUEPRINT_DATA/CRD/THREE_CELL_TYPES/CLOMICS/EGAD00001002673_CLOMICS_v3.0/EGAD00001002673_ALL.chr18.module.txt.gz]
  * #nodes = 5869
  * #internal_nodes = 2934
  * #leaf_nodes = 2935

Reading modules in [/data/unige/funpopgen/grey2/SYSCID/BLUEPRINT_DATA/CRD/THREE_CELL_TYPES/CLOMICS/EGAD00001002673_CLOMICS_v3.0/EGAD00001002673_ALL.modules.MOD1.NRE2.txt.gz]
  * #modules = 4947

Quantify activity of internal nodes
  * Mean
  * loo on 2
  * loo on 2
  * loo on 2
  * loo on 2
  * loo on 3
  * loo on 2
  * loo on 3
  * loo on 28
  * loo on 2
  * loo on 3
  * loo on 2
  * loo on 3
  * loo on 2
  * loo on 2
  * loo on 2
  * loo on 4
  * loo on 6
  * loo on 12
  * loo on 2
  * loo on 4
  * loo on 2
  * loo on 3
  * loo on 2
  * loo on 3
  * loo on 3
  * loo on 2
  * loo on 3
  * loo on 6
  * loo on 2
  * loo on 2
  * loo on 2
  * loo on 2
  * loo on 2
  * loo on 2
  * loo on 2
  * loo on 3
  * loo on 6
  * loo on 2
  * loo on 5
  * loo on 3
  * loo on 3
  * loo on 3
  * loo on 3
  * loo on 2
  * loo on 2
  * loo on 2
  * loo on 2
  * loo on 2
  * loo on 2
  * loo on 8
  * loo on 11
  * loo on 2
  * loo on 7
  * loo on 2
  * loo on 7
  * loo on 10
  * loo on 15
  * loo on 3
  * loo on 2
  * loo on 3
  * loo on 2
  * loo on 8
  * loo on 3
  * loo on 2
  * loo on 5
  * loo on 2
  * loo on 5
  * loo on 2
  * loo on 3
  * loo on 16
  * loo on 4
  * loo on 8
  * loo on 4
  * loo on 5
  * loo on 3
  * loo on 2
  * loo on 3
  * loo on 4
  * loo on 8
  * loo on 12
  * quantification finished

Writing quantifications in [/data/unige/funpopgen/grey2/SYSCID/BLUEPRINT_DATA/CRD/THREE_CELL_TYPES/CLOMICS/CELL_TYPE_COMPARISON_GENE_CRD_ASSOCIATIONS/quantify//72_vs_73_ALL.chr18.loom.txt.gz]
  * writing header
  * writing body

Running time: 1 seconds
Sender: LSF System <lsfadmin@cpt05>
Subject: Job 973332: </data/unige/funpopgen/odelanea/SHARE/clomics/bin/clomics quantify --bed /data/unige/funpopgen/grey2/SYSCID/BLUEPRINT_DATA/CRD/THREE_CELL_TYPES/CLOMICS/EGAD00001002672_CLOMICS_v3.0/merged_residuals.bed.gz --region 18 --tree /data/unige/funpopgen/grey2/SYSCID/BLUEPRINT_DATA/CRD/THREE_CELL_TYPES/CLOMICS/EGAD00001002673_CLOMICS_v3.0/EGAD00001002673_ALL.chr18.module.txt.gz /data/unige/funpopgen/grey2/SYSCID/BLUEPRINT_DATA/CRD/THREE_CELL_TYPES/CLOMICS/EGAD00001002673_CLOMICS_v3.0/EGAD00001002673_ALL.modules.MOD1.NRE2.txt.gz --out /data/unige/funpopgen/grey2/SYSCID/BLUEPRINT_DATA/CRD/THREE_CELL_TYPES/CLOMICS/CELL_TYPE_COMPARISON_GENE_CRD_ASSOCIATIONS/quantify//72_vs_73_ALL.chr18.loom\.txt.gz --loo 0 --normal> in cluster <ug> Done

Job </data/unige/funpopgen/odelanea/SHARE/clomics/bin/clomics quantify --bed /data/unige/funpopgen/grey2/SYSCID/BLUEPRINT_DATA/CRD/THREE_CELL_TYPES/CLOMICS/EGAD00001002672_CLOMICS_v3.0/merged_residuals.bed.gz --region 18 --tree /data/unige/funpopgen/grey2/SYSCID/BLUEPRINT_DATA/CRD/THREE_CELL_TYPES/CLOMICS/EGAD00001002673_CLOMICS_v3.0/EGAD00001002673_ALL.chr18.module.txt.gz /data/unige/funpopgen/grey2/SYSCID/BLUEPRINT_DATA/CRD/THREE_CELL_TYPES/CLOMICS/EGAD00001002673_CLOMICS_v3.0/EGAD00001002673_ALL.modules.MOD1.NRE2.txt.gz --out /data/unige/funpopgen/grey2/SYSCID/BLUEPRINT_DATA/CRD/THREE_CELL_TYPES/CLOMICS/CELL_TYPE_COMPARISON_GENE_CRD_ASSOCIATIONS/quantify//72_vs_73_ALL.chr18.loom\.txt.gz --loo 0 --normal> was submitted from host <frt.ug.vital-it.ch> by user <grey2> in cluster <ug>.
Job was executed on host(s) <cpt05>, in queue <normal>, as user <grey2> in cluster <ug>.
</home/grey2> was used as the home directory.
</data/unige/funpopgen/grey2/SYSCID/BLUEPRINT_DATA/CRD/THREE_CELL_TYPES/CLOMICS/CELL_TYPE_COMPARISON_GENE_CRD_ASSOCIATIONS> was used as the working directory.
Started at Thu Mar 21 11:10:33 2019
Results reported at Thu Mar 21 11:10:37 2019

Your job looked like:

------------------------------------------------------------
# LSBATCH: User input
/data/unige/funpopgen/odelanea/SHARE/clomics/bin/clomics quantify --bed /data/unige/funpopgen/grey2/SYSCID/BLUEPRINT_DATA/CRD/THREE_CELL_TYPES/CLOMICS/EGAD00001002672_CLOMICS_v3.0/merged_residuals.bed.gz --region 18 --tree /data/unige/funpopgen/grey2/SYSCID/BLUEPRINT_DATA/CRD/THREE_CELL_TYPES/CLOMICS/EGAD00001002673_CLOMICS_v3.0/EGAD00001002673_ALL.chr18.module.txt.gz /data/unige/funpopgen/grey2/SYSCID/BLUEPRINT_DATA/CRD/THREE_CELL_TYPES/CLOMICS/EGAD00001002673_CLOMICS_v3.0/EGAD00001002673_ALL.modules.MOD1.NRE2.txt.gz --out /data/unige/funpopgen/grey2/SYSCID/BLUEPRINT_DATA/CRD/THREE_CELL_TYPES/CLOMICS/CELL_TYPE_COMPARISON_GENE_CRD_ASSOCIATIONS/quantify//72_vs_73_ALL.chr18.loom\.txt.gz --loo 0 --normal

------------------------------------------------------------

Successfully completed.

Resource usage summary:

    CPU time :               1.42 sec.
    Max Memory :             4.54 MB
    Average Memory :         4.54 MB
    Total Requested Memory : 8000.00 MB
    Delta Memory :           7995.46 MB
    (Delta: the difference between total requested memory and actual max usage.)
    Max Swap :               239 MB

    Max Processes :          3
    Max Threads :            4

The output (if any) follows:


[32mclomics[0m
  * Authors : Olivier DELANEAU / Emmanouil DERMITZAKIS
  * Contact : olivier.delaneau@gmail.com
  * Webpage : XXX
  * Version : XXX
  * Date    : 21/03/2019 - 11:10:36

[32mQUANTIFY MODULES[0m

Initialize random number generator
  * Built-in seed is 15112011
  * First Integer = 30554
  * First Double = 0.0126695

Reading sample list from [/data/unige/funpopgen/grey2/SYSCID/BLUEPRINT_DATA/CRD/THREE_CELL_TYPES/CLOMICS/EGAD00001002672_CLOMICS_v3.0/merged_residuals.bed.gz]
  * #samples = 160

Merging sample sets from all input files
  * #files = 1
  * #samples in all files = 160

Scanning phenotype data in [/data/unige/funpopgen/grey2/SYSCID/BLUEPRINT_DATA/CRD/THREE_CELL_TYPES/CLOMICS/EGAD00001002672_CLOMICS_v3.0/merged_residuals.bed.gz]
  * target region [18]
  * 2935 phenotypes included

Sorting phenotype data and allocating required memory
  * #samples = 160 #phenotypes = 2935

Reading phenotype data in [/data/unige/funpopgen/grey2/SYSCID/BLUEPRINT_DATA/CRD/THREE_CELL_TYPES/CLOMICS/EGAD00001002672_CLOMICS_v3.0/merged_residuals.bed.gz]
  * target region [18]
  * 2935 phenotypes included

Reading tree in [/data/unige/funpopgen/grey2/SYSCID/BLUEPRINT_DATA/CRD/THREE_CELL_TYPES/CLOMICS/EGAD00001002673_CLOMICS_v3.0/EGAD00001002673_ALL.chr18.module.txt.gz]
  * #nodes = 5869
  * #internal_nodes = 2934
  * #leaf_nodes = 2935

Reading modules in [/data/unige/funpopgen/grey2/SYSCID/BLUEPRINT_DATA/CRD/THREE_CELL_TYPES/CLOMICS/EGAD00001002673_CLOMICS_v3.0/EGAD00001002673_ALL.modules.MOD1.NRE2.txt.gz]
  * #modules = 4947

Quantify activity of internal nodes
  * Mean
  * loo on 2
  * loo on 2
  * loo on 2
  * loo on 2
  * loo on 3
  * loo on 2
  * loo on 3
  * loo on 28
  * loo on 2
  * loo on 3
  * loo on 2
  * loo on 3
  * loo on 2
  * loo on 2
  * loo on 2
  * loo on 4
  * loo on 6
  * loo on 12
  * loo on 2
  * loo on 4
  * loo on 2
  * loo on 3
  * loo on 2
  * loo on 3
  * loo on 3
  * loo on 2
  * loo on 3
  * loo on 6
  * loo on 2
  * loo on 2
  * loo on 2
  * loo on 2
  * loo on 2
  * loo on 2
  * loo on 2
  * loo on 3
  * loo on 6
  * loo on 2
  * loo on 5
  * loo on 3
  * loo on 3
  * loo on 3
  * loo on 3
  * loo on 2
  * loo on 2
  * loo on 2
  * loo on 2
  * loo on 2
  * loo on 2
  * loo on 8
  * loo on 11
  * loo on 2
  * loo on 7
  * loo on 2
  * loo on 7
  * loo on 10
  * loo on 15
  * loo on 3
  * loo on 2
  * loo on 3
  * loo on 2
  * loo on 8
  * loo on 3
  * loo on 2
  * loo on 5
  * loo on 2
  * loo on 5
  * loo on 2
  * loo on 3
  * loo on 16
  * loo on 4
  * loo on 8
  * loo on 4
  * loo on 5
  * loo on 3
  * loo on 2
  * loo on 3
  * loo on 4
  * loo on 8
  * loo on 12
  * quantification finished

Writing quantifications in [/data/unige/funpopgen/grey2/SYSCID/BLUEPRINT_DATA/CRD/THREE_CELL_TYPES/CLOMICS/CELL_TYPE_COMPARISON_GENE_CRD_ASSOCIATIONS/quantify//72_vs_73_ALL.chr18.loom.txt.gz]
  * writing header
  * writing body

Running time: 1 seconds
