Sender: LSF System <lsfadmin@cpt05>
Subject: Job 971441: </data/unige/funpopgen/odelanea/SHARE/clomics/bin/clomics quantify --bed /data/unige/funpopgen/grey2/SYSCID/BLUEPRINT_DATA/CRD/THREE_CELL_TYPES/CLOMICS/EGAD00001002672_CLOMICS_v3.0/merged_residuals.bed.gz --region 21 --tree /data/unige/funpopgen/grey2/SYSCID/BLUEPRINT_DATA/CRD/THREE_CELL_TYPES/CLOMICS/EGAD00001002673_CLOMICS_v3.0/EGAD00001002673_ALL.chr21.module.txt.gz /data/unige/funpopgen/grey2/SYSCID/BLUEPRINT_DATA/CRD/THREE_CELL_TYPES/CLOMICS/EGAD00001002673_CLOMICS_v3.0/EGAD00001002673_ALL.modules.MOD1.NRE2.txt.gz --out /data/unige/funpopgen/grey2/SYSCID/BLUEPRINT_DATA/CRD/THREE_CELL_TYPES/CLOMICS/CELL_TYPE_COMPARISON_GENE_CRD_ASSOCIATIONS/quantify//72_vs_73_ALL.chr21.loom\.txt.gz --loo 0 --normal> in cluster <ug> Done

Job </data/unige/funpopgen/odelanea/SHARE/clomics/bin/clomics quantify --bed /data/unige/funpopgen/grey2/SYSCID/BLUEPRINT_DATA/CRD/THREE_CELL_TYPES/CLOMICS/EGAD00001002672_CLOMICS_v3.0/merged_residuals.bed.gz --region 21 --tree /data/unige/funpopgen/grey2/SYSCID/BLUEPRINT_DATA/CRD/THREE_CELL_TYPES/CLOMICS/EGAD00001002673_CLOMICS_v3.0/EGAD00001002673_ALL.chr21.module.txt.gz /data/unige/funpopgen/grey2/SYSCID/BLUEPRINT_DATA/CRD/THREE_CELL_TYPES/CLOMICS/EGAD00001002673_CLOMICS_v3.0/EGAD00001002673_ALL.modules.MOD1.NRE2.txt.gz --out /data/unige/funpopgen/grey2/SYSCID/BLUEPRINT_DATA/CRD/THREE_CELL_TYPES/CLOMICS/CELL_TYPE_COMPARISON_GENE_CRD_ASSOCIATIONS/quantify//72_vs_73_ALL.chr21.loom\.txt.gz --loo 0 --normal> was submitted from host <cpt01> by user <grey2> in cluster <ug>.
Job was executed on host(s) <cpt05>, in queue <normal>, as user <grey2> in cluster <ug>.
</home/grey2> was used as the home directory.
</data/unige/funpopgen/grey2/SYSCID/BLUEPRINT_DATA/CRD/THREE_CELL_TYPES/CLOMICS/CELL_TYPE_COMPARISON_GENE_CRD_ASSOCIATIONS> was used as the working directory.
Started at Fri Mar 15 13:43:38 2019
Results reported at Fri Mar 15 13:43:41 2019

Your job looked like:

------------------------------------------------------------
# LSBATCH: User input
/data/unige/funpopgen/odelanea/SHARE/clomics/bin/clomics quantify --bed /data/unige/funpopgen/grey2/SYSCID/BLUEPRINT_DATA/CRD/THREE_CELL_TYPES/CLOMICS/EGAD00001002672_CLOMICS_v3.0/merged_residuals.bed.gz --region 21 --tree /data/unige/funpopgen/grey2/SYSCID/BLUEPRINT_DATA/CRD/THREE_CELL_TYPES/CLOMICS/EGAD00001002673_CLOMICS_v3.0/EGAD00001002673_ALL.chr21.module.txt.gz /data/unige/funpopgen/grey2/SYSCID/BLUEPRINT_DATA/CRD/THREE_CELL_TYPES/CLOMICS/EGAD00001002673_CLOMICS_v3.0/EGAD00001002673_ALL.modules.MOD1.NRE2.txt.gz --out /data/unige/funpopgen/grey2/SYSCID/BLUEPRINT_DATA/CRD/THREE_CELL_TYPES/CLOMICS/CELL_TYPE_COMPARISON_GENE_CRD_ASSOCIATIONS/quantify//72_vs_73_ALL.chr21.loom\.txt.gz --loo 0 --normal

------------------------------------------------------------

Successfully completed.

Resource usage summary:

    CPU time :               2.18 sec.
    Max Memory :             15.67 MB
    Average Memory :         15.67 MB
    Total Requested Memory : 8000.00 MB
    Delta Memory :           7984.33 MB
    (Delta: the difference between total requested memory and actual max usage.)
    Max Swap :               347 MB

    Max Processes :          4
    Max Threads :            5

The output (if any) follows:


[32mclomics[0m
  * Authors : Olivier DELANEAU / Emmanouil DERMITZAKIS
  * Contact : olivier.delaneau@gmail.com
  * Webpage : XXX
  * Version : XXX
  * Date    : 15/03/2019 - 13:43:39

[32mQUANTIFY MODULES[0m

Initialize random number generator
  * Built-in seed is 15112011
  * First Integer = 30554
  * First Double = 0.0126695

Reading sample list from [/data/unige/funpopgen/grey2/SYSCID/BLUEPRINT_DATA/CRD/THREE_CELL_TYPES/CLOMICS/EGAD00001002672_CLOMICS_v3.0/merged_residuals.bed.gz]
  * #samples = 160

Merging sample sets from all input files
  * #files = 1
  * #samples in all files = 160

Scanning phenotype data in [/data/unige/funpopgen/grey2/SYSCID/BLUEPRINT_DATA/CRD/THREE_CELL_TYPES/CLOMICS/EGAD00001002672_CLOMICS_v3.0/merged_residuals.bed.gz]
  * target region [21]
  * 2101 phenotypes included

Sorting phenotype data and allocating required memory
  * #samples = 160 #phenotypes = 2101

Reading phenotype data in [/data/unige/funpopgen/grey2/SYSCID/BLUEPRINT_DATA/CRD/THREE_CELL_TYPES/CLOMICS/EGAD00001002672_CLOMICS_v3.0/merged_residuals.bed.gz]
  * target region [21]
  * 2101 phenotypes included

Reading tree in [/data/unige/funpopgen/grey2/SYSCID/BLUEPRINT_DATA/CRD/THREE_CELL_TYPES/CLOMICS/EGAD00001002673_CLOMICS_v3.0/EGAD00001002673_ALL.chr21.module.txt.gz]
  * #nodes = 4201
  * #internal_nodes = 2100
  * #leaf_nodes = 2101

Reading modules in [/data/unige/funpopgen/grey2/SYSCID/BLUEPRINT_DATA/CRD/THREE_CELL_TYPES/CLOMICS/EGAD00001002673_CLOMICS_v3.0/EGAD00001002673_ALL.modules.MOD1.NRE2.txt.gz]
  * #modules = 4947

Quantify activity of internal nodes
  * Mean
  * loo on 5
  * loo on 2
  * loo on 2
  * loo on 3
  * loo on 2
  * loo on 2
  * loo on 3
  * loo on 5
  * loo on 4
  * loo on 2
  * loo on 2
  * loo on 2
  * loo on 3
  * loo on 3
  * loo on 2
  * loo on 2
  * loo on 6
  * loo on 14
  * loo on 2
  * loo on 6
  * loo on 2
  * loo on 2
  * loo on 5
  * loo on 5
  * loo on 5
  * loo on 10
  * loo on 2
  * loo on 4
  * loo on 15
  * loo on 6
  * loo on 3
  * loo on 2
  * loo on 2
  * loo on 17
  * loo on 9
  * loo on 2
  * loo on 2
  * loo on 2
  * loo on 3
  * loo on 2
  * loo on 6
  * loo on 2
  * loo on 3
  * loo on 2
  * loo on 4
  * loo on 40
  * loo on 45
  * loo on 2
  * loo on 2
  * loo on 6
  * loo on 25
  * loo on 4
  * loo on 2
  * loo on 8
  * loo on 8
  * loo on 2
  * loo on 4
  * loo on 2
  * loo on 4
  * loo on 11
  * loo on 5
  * loo on 2
  * loo on 2
  * loo on 3
  * loo on 17
  * loo on 6
  * loo on 7
  * loo on 2
  * loo on 2
  * loo on 3
  * loo on 2
  * loo on 16
  * loo on 4
  * loo on 2
  * loo on 2
  * loo on 2
  * loo on 2
  * loo on 3
  * loo on 3
  * loo on 2
  * loo on 2
  * loo on 3
  * loo on 6
  * loo on 2
  * loo on 2
  * loo on 4
  * loo on 2
  * loo on 2
  * quantification finished

Writing quantifications in [/data/unige/funpopgen/grey2/SYSCID/BLUEPRINT_DATA/CRD/THREE_CELL_TYPES/CLOMICS/CELL_TYPE_COMPARISON_GENE_CRD_ASSOCIATIONS/quantify//72_vs_73_ALL.chr21.loom.txt.gz]
  * writing header
  * writing body

Running time: 2 seconds
Sender: LSF System <lsfadmin@cpt16>
Subject: Job 973341: </data/unige/funpopgen/odelanea/SHARE/clomics/bin/clomics quantify --bed /data/unige/funpopgen/grey2/SYSCID/BLUEPRINT_DATA/CRD/THREE_CELL_TYPES/CLOMICS/EGAD00001002672_CLOMICS_v3.0/merged_residuals.bed.gz --region 21 --tree /data/unige/funpopgen/grey2/SYSCID/BLUEPRINT_DATA/CRD/THREE_CELL_TYPES/CLOMICS/EGAD00001002673_CLOMICS_v3.0/EGAD00001002673_ALL.chr21.module.txt.gz /data/unige/funpopgen/grey2/SYSCID/BLUEPRINT_DATA/CRD/THREE_CELL_TYPES/CLOMICS/EGAD00001002673_CLOMICS_v3.0/EGAD00001002673_ALL.modules.MOD1.NRE2.txt.gz --out /data/unige/funpopgen/grey2/SYSCID/BLUEPRINT_DATA/CRD/THREE_CELL_TYPES/CLOMICS/CELL_TYPE_COMPARISON_GENE_CRD_ASSOCIATIONS/quantify//72_vs_73_ALL.chr21.loom\.txt.gz --loo 0 --normal> in cluster <ug> Done

Job </data/unige/funpopgen/odelanea/SHARE/clomics/bin/clomics quantify --bed /data/unige/funpopgen/grey2/SYSCID/BLUEPRINT_DATA/CRD/THREE_CELL_TYPES/CLOMICS/EGAD00001002672_CLOMICS_v3.0/merged_residuals.bed.gz --region 21 --tree /data/unige/funpopgen/grey2/SYSCID/BLUEPRINT_DATA/CRD/THREE_CELL_TYPES/CLOMICS/EGAD00001002673_CLOMICS_v3.0/EGAD00001002673_ALL.chr21.module.txt.gz /data/unige/funpopgen/grey2/SYSCID/BLUEPRINT_DATA/CRD/THREE_CELL_TYPES/CLOMICS/EGAD00001002673_CLOMICS_v3.0/EGAD00001002673_ALL.modules.MOD1.NRE2.txt.gz --out /data/unige/funpopgen/grey2/SYSCID/BLUEPRINT_DATA/CRD/THREE_CELL_TYPES/CLOMICS/CELL_TYPE_COMPARISON_GENE_CRD_ASSOCIATIONS/quantify//72_vs_73_ALL.chr21.loom\.txt.gz --loo 0 --normal> was submitted from host <frt.ug.vital-it.ch> by user <grey2> in cluster <ug>.
Job was executed on host(s) <cpt16>, in queue <normal>, as user <grey2> in cluster <ug>.
</home/grey2> was used as the home directory.
</data/unige/funpopgen/grey2/SYSCID/BLUEPRINT_DATA/CRD/THREE_CELL_TYPES/CLOMICS/CELL_TYPE_COMPARISON_GENE_CRD_ASSOCIATIONS> was used as the working directory.
Started at Thu Mar 21 11:10:38 2019
Results reported at Thu Mar 21 11:10:44 2019

Your job looked like:

------------------------------------------------------------
# LSBATCH: User input
/data/unige/funpopgen/odelanea/SHARE/clomics/bin/clomics quantify --bed /data/unige/funpopgen/grey2/SYSCID/BLUEPRINT_DATA/CRD/THREE_CELL_TYPES/CLOMICS/EGAD00001002672_CLOMICS_v3.0/merged_residuals.bed.gz --region 21 --tree /data/unige/funpopgen/grey2/SYSCID/BLUEPRINT_DATA/CRD/THREE_CELL_TYPES/CLOMICS/EGAD00001002673_CLOMICS_v3.0/EGAD00001002673_ALL.chr21.module.txt.gz /data/unige/funpopgen/grey2/SYSCID/BLUEPRINT_DATA/CRD/THREE_CELL_TYPES/CLOMICS/EGAD00001002673_CLOMICS_v3.0/EGAD00001002673_ALL.modules.MOD1.NRE2.txt.gz --out /data/unige/funpopgen/grey2/SYSCID/BLUEPRINT_DATA/CRD/THREE_CELL_TYPES/CLOMICS/CELL_TYPE_COMPARISON_GENE_CRD_ASSOCIATIONS/quantify//72_vs_73_ALL.chr21.loom\.txt.gz --loo 0 --normal

------------------------------------------------------------

Successfully completed.

Resource usage summary:

    CPU time :               2.18 sec.
    Max Memory :             3.04 MB
    Average Memory :         3.04 MB
    Total Requested Memory : 8000.00 MB
    Delta Memory :           7996.96 MB
    (Delta: the difference between total requested memory and actual max usage.)
    Max Swap :               31 MB

    Max Processes :          1
    Max Threads :            1

The output (if any) follows:


[32mclomics[0m
  * Authors : Olivier DELANEAU / Emmanouil DERMITZAKIS
  * Contact : olivier.delaneau@gmail.com
  * Webpage : XXX
  * Version : XXX
  * Date    : 21/03/2019 - 11:10:41

[32mQUANTIFY MODULES[0m

Initialize random number generator
  * Built-in seed is 15112011
  * First Integer = 30554
  * First Double = 0.0126695

Reading sample list from [/data/unige/funpopgen/grey2/SYSCID/BLUEPRINT_DATA/CRD/THREE_CELL_TYPES/CLOMICS/EGAD00001002672_CLOMICS_v3.0/merged_residuals.bed.gz]
  * #samples = 160

Merging sample sets from all input files
  * #files = 1
  * #samples in all files = 160

Scanning phenotype data in [/data/unige/funpopgen/grey2/SYSCID/BLUEPRINT_DATA/CRD/THREE_CELL_TYPES/CLOMICS/EGAD00001002672_CLOMICS_v3.0/merged_residuals.bed.gz]
  * target region [21]
  * 2101 phenotypes included

Sorting phenotype data and allocating required memory
  * #samples = 160 #phenotypes = 2101

Reading phenotype data in [/data/unige/funpopgen/grey2/SYSCID/BLUEPRINT_DATA/CRD/THREE_CELL_TYPES/CLOMICS/EGAD00001002672_CLOMICS_v3.0/merged_residuals.bed.gz]
  * target region [21]
  * 2101 phenotypes included

Reading tree in [/data/unige/funpopgen/grey2/SYSCID/BLUEPRINT_DATA/CRD/THREE_CELL_TYPES/CLOMICS/EGAD00001002673_CLOMICS_v3.0/EGAD00001002673_ALL.chr21.module.txt.gz]
  * #nodes = 4201
  * #internal_nodes = 2100
  * #leaf_nodes = 2101

Reading modules in [/data/unige/funpopgen/grey2/SYSCID/BLUEPRINT_DATA/CRD/THREE_CELL_TYPES/CLOMICS/EGAD00001002673_CLOMICS_v3.0/EGAD00001002673_ALL.modules.MOD1.NRE2.txt.gz]
  * #modules = 4947

Quantify activity of internal nodes
  * Mean
  * loo on 5
  * loo on 2
  * loo on 2
  * loo on 3
  * loo on 2
  * loo on 2
  * loo on 3
  * loo on 5
  * loo on 4
  * loo on 2
  * loo on 2
  * loo on 2
  * loo on 3
  * loo on 3
  * loo on 2
  * loo on 2
  * loo on 6
  * loo on 14
  * loo on 2
  * loo on 6
  * loo on 2
  * loo on 2
  * loo on 5
  * loo on 5
  * loo on 5
  * loo on 10
  * loo on 2
  * loo on 4
  * loo on 15
  * loo on 6
  * loo on 3
  * loo on 2
  * loo on 2
  * loo on 17
  * loo on 9
  * loo on 2
  * loo on 2
  * loo on 2
  * loo on 3
  * loo on 2
  * loo on 6
  * loo on 2
  * loo on 3
  * loo on 2
  * loo on 4
  * loo on 40
  * loo on 45
  * loo on 2
  * loo on 2
  * loo on 6
  * loo on 25
  * loo on 4
  * loo on 2
  * loo on 8
  * loo on 8
  * loo on 2
  * loo on 4
  * loo on 2
  * loo on 4
  * loo on 11
  * loo on 5
  * loo on 2
  * loo on 2
  * loo on 3
  * loo on 17
  * loo on 6
  * loo on 7
  * loo on 2
  * loo on 2
  * loo on 3
  * loo on 2
  * loo on 16
  * loo on 4
  * loo on 2
  * loo on 2
  * loo on 2
  * loo on 2
  * loo on 3
  * loo on 3
  * loo on 2
  * loo on 2
  * loo on 3
  * loo on 6
  * loo on 2
  * loo on 2
  * loo on 4
  * loo on 2
  * loo on 2
  * quantification finished

Writing quantifications in [/data/unige/funpopgen/grey2/SYSCID/BLUEPRINT_DATA/CRD/THREE_CELL_TYPES/CLOMICS/CELL_TYPE_COMPARISON_GENE_CRD_ASSOCIATIONS/quantify//72_vs_73_ALL.chr21.loom.txt.gz]
  * writing header
  * writing body

Running time: 2 seconds
